<?xml version="1.0" encoding="UTF-8"?>
<xs:schema xmlns:xs="http://www.w3.org/2001/XMLSchema">
  <xs:element name="courses">
    <xs:complexType>
      <xs:sequence>
        <xs:element name="course" maxOccurs="unbounded" minOccurs="1">
          <xs:complexType>
            <xs:sequence>
              <xs:element name="title" type="xs:string" />
              <xs:element name="instructor" type="xs:string" />
              <xs:element name="prerequisite" type="xs:string" />
              <xs:element name="facultyQualification" type="xs:string" />
              <xs:element name="journals">
                <xs:complexType>
                  <xs:attribute name="international" type="xs:nonNegativeInteger" use="required" />
                  <xs:attribute name="national" type="xs:nonNegativeInteger" use="required" />
                </xs:complexType>
              </xs:element>
              <xs:element name="price">
                <xs:complexType>
                  <xs:simpleContent>
                    <xs:extension base="xs:decimal">
                      <xs:attribute name="currency" use="required">
                        <xs:simpleType>
                          <xs:restriction base="xs:string">
                            <xs:enumeration value="INR" />
                          </xs:restriction>
                        </xs:simpleType>
                      </xs:attribute>
                    </xs:extension>
                  </xs:simpleContent>
                </xs:complexType>
              </xs:element>
              <xs:element name="duration">
                <xs:complexType>
                  <xs:simpleContent>
                    <xs:extension base="xs:positiveInteger">
                      <xs:attribute name="unit" use="required">
                        <xs:simpleType>
                          <xs:restriction base="xs:string">
                            <xs:enumeration value="months" />
                          </xs:restriction>
                        </xs:simpleType>
                      </xs:attribute>
                    </xs:extension>
                  </xs:simpleContent>
                </xs:complexType>
              </xs:element>
              <xs:element name="rating">
                <xs:simpleType>
                  <xs:restriction base="xs:decimal">
                    <xs:minInclusive value="0.0" />
                    <xs:maxInclusive value="5.0" />
                  </xs:restriction>
                </xs:simpleType>
              </xs:element>
              <xs:element name="level" type="xs:string" />
              <xs:element name="focus" type="xs:string" />
            </xs:sequence>
            <xs:attribute name="id" type="xs:ID" use="required" />
          </xs:complexType>
        </xs:element>
      </xs:sequence>
    </xs:complexType>
  </xs:element>
</xs:schema>
